Title,Abstract,PMID,PMCID,DOI,Cited Number,journal_title,Journal_id,impact_factor,relevance_score,cited_Normalized,impact_Normalized,final_score
Novel Approaches for the Treatment of Alzheimer's and Parkinson's Disease,"Neurodegenerative disorders affect around one billion people worldwide. They can arise from a combination of genomic, epigenomic, metabolic, and environmental factors. Aging is the leading risk factor for most chronic illnesses of old age, including Alzheimer's and Parkinson's diseases. A progressive neurodegenerative process and neuroinflammation occur, and no current therapies can prevent, slow, or halt disease progression. To date, no novel disease-modifying therapies have been shown to provide significant benefit for patients who suffer from these devastating disorders. Therefore, early diagnosis and the discovery of new targets and novel therapies are of upmost importance. Neurodegenerative diseases, like in other age-related disorders, the progression of pathology begins many years before the onset of symptoms. Many efforts in this field have led to the conclusion that exits some similar events among these diseases that can explain why the aging brain is so vulnerable to suffer neurodegenerative diseases. This article reviews the current knowledge about these diseases by summarizing the most common features of major neurodegenerative disorders, their causes and consequences, and the proposed novel therapeutic approaches.",30743990,PMC6386829,10.3390/ijms20030719,67,International journal of molecular sciences,101092791,6.208,0.4203020930290222,0.9364548494983278,0.6521739130434783,1.6810722257170787
[Signaling molecules in the brain and epigenetic factors in neurodegenerative and mental disorders],"The literature on a role of signaling molecules in the organization of memory and cognitive functions is analyzed basing on mechanisms of memory physiology determined by a complex of biochemical processes initiated by the transmission of the signal to the synapse and completed by the synthesis of functionally significant molecules in the neuronal genetic apparatus. The center of these processes is a coordinated system of signal transduction, transcription, epigenetic and neurotrophic molecules. The dissonance of signal mechanisms is a prime cause of memory impairment and cognitive dysfunction as social maladaptation factors. The results of experimental and clinical studies of a role of the multilevel signaling system in age-related, neurodegenerative (Alzheimer’s disease) and mental (depression) disorders are discussed. At the same time, signaling molecules may be considered as particular targets for new therapeutic approaches.",26649375,,10.17116/jnevro2015115101102-110,0,Zhurnal nevrologii i psikhiatrii imeni S.S. Korsakova,9712194,0.0,0.41401010751724243,0.030100334448160536,0.04013377926421405,0.25442613139997755
Applying gene-editing technology to elucidate the functional consequence of genetic and epigenetic variation in Alzheimer's disease,"Recent studies have highlighted a potential role of genetic and epigenetic variation in the development of Alzheimer's disease. Application of the CRISPR-Cas genome-editing platform has enabled investigation of the functional impact that Alzheimer's disease-associated gene mutations have on gene expression. Moreover, recent advances in the technology have led to the generation of CRISPR-Cas-based tools that allow for high-throughput interrogation of different risk variants to elucidate the interplay between genomic regulatory features, epigenetic modifications, and chromatin structure. In this review, we examine the various iterations of the CRISPR-Cas system and their potential application for exploring the complex interactions and disruptions in gene regulatory circuits that contribute to Alzheimer's disease.",32654206,PMC8018012,10.1111/bpa.12881,6,"Brain pathology (Zurich, Switzerland)",9216781,7.611,0.4119977653026581,0.4080267558528428,0.7926421404682275,1.8510040103521632
Role of primary aging hallmarks in Alzheimer´s disease,"Alzheimer's disease (AD) is the most common neurodegenerative disease, which severely threatens the health of the elderly and causes significant economic and social burdens. The causes of AD are complex and include heritable but mostly aging-related factors. The primary aging hallmarks include genomic instability, telomere wear, epigenetic changes, and loss of protein stability, which play a dominant role in the aging process. Although AD is closely associated with the aging process, the underlying mechanisms involved in AD pathogenesis have not been well characterized. This review summarizes the available literature about primary aging hallmarks and their roles in AD pathogenesis. By analyzing published literature, we attempted to uncover the possible mechanisms of aberrant epigenetic markers with related enzymes, transcription factors, and loss of proteostasis in AD. In particular, the importance of oxidative stress-induced DNA methylation and DNA methylation-directed histone modifications and proteostasis are highlighted. A molecular network of gene regulatory elements that undergoes a dynamic change with age may underlie age-dependent AD pathogenesis, and can be used as a new drug target to treat AD.",36593969,PMC9800733,10.7150/thno.79535,6,Theranostics,101552395,11.6,0.41134732961654663,0.411371237458194,0.919732441471572,2.649082645261567
[The role of aluminum and lead in the development of Alzheimer's and Parkinson's diseases],"The article summarizes the data available in the literature on the toxic effects of aluminum and lead on the human brain and assesses the relationship of these effects to the etiopathogenesis of the most common neurodegenerative diseases, such as Alzheimer's and Parkinson's diseases. The accumulation of ions of these metals in the brain structures leads to chronic intoxication that is manifested by the morphological signs that are typical for Alzheimer's disease, such as deposits of β-amyloid and τ-protein mainly in the frontal and temporal regions of the cortex, and for Parkinson's disease, such as degeneration of dopamine neurons in the substantia nigra and their accumulation of α-synuclein. The most likely forms of participation of aluminum and lead ions in the mechanisms of neurodegeneration are the replacement of bivalent metal ions necessary for brain functioning, oxidative stress initiation, epigenetic modifications of histones, and increased expression of noncoding ribonucleic acids.",34041898,,10.17116/patol20218303156,0,Arkhiv patologii,0370604,0.0,0.4083947539329529,0.033444816053511704,0.043478260869565216,0.2517258155704741
Assessment of suberoylanilide hydroxamic acid on a Alzheimer's disease model induced by β-amyloid(1-42)in aged female mice: Neuromodulatory and epigenetic effect,"Alzheimer's disease (AD) is a neurodegenerative disease that affects several elderly people per years. AD is a pathology of multifactorial etiology, resulting from multiple environmental and genetic determinants. However, there is no effective pharmacological alternative for the treatment of this illness. In this sense, the purpose of current study was to characterize the mechanisms by which Aβ1-42injection via intracerebroventricular induces neurobehavioral changes in a time-course curve. In addition, suberoylanilide hydroxamic acid (SAHA) inhibitor of histone deacetylase (HDAC) was used to investigate the involvement of epigenetic modifications Aβ1-42-caused in aged female mice. In general manner, Aβ1-42injection induced a major neurochemical disturbance in hippocampus and prefrontal cortex of animals and a serious impairment of memory. Overall, SAHA treatment attenuated neurobehavioral changes caused by Aβ1-42injection in aged female mice. The subchronic effects presented of SAHA were through modulation of HDAC activity, regulation of brain-derived neurotrophic factor (BDNF) levels and expression of BDNF mRNA, accompanied by unlocking cAMP/PKA/pCREB pathway in hippocampus and prefrontal cortex of animals.",36870467,,10.1016/j.cbi.2023.110429,2,Chemico-biological interactions,0227276,0.0,0.4049191474914551,0.21739130434782608,0.046822742474916385,0.28642974936443827
Prion-like mechanisms and potential therapeutic targets in neurodegenerative disorders,"Prion-like propagation of abnormal intracytoplasmic proteins, which are the defining features of major neurodegenerative disorders, such as Alzheimer's disease (AD), Parkinson's disease (PD) and amyotrophic lateral sclerosis (ALS), has been proposed. A growing body of evidence strongly suggests that abnormal tau, α-synuclein and TDP-43 have prion-like properties, convert the corresponding normal proteins into abnormal forms, and are transmitted from cell to cell, spreading throughout the brain. This idea is extremely important not only for understanding the pathogenesis and progression of these diseases, but also for the development of molecular therapies. Since the distributions and spreading of the abnormal proteins are closely associated with disease symptoms and progression, gain-of-toxic-function of these proteins may affect the neurons and glial cells either directly or indirectly, or both. It is essential to regulate the aggregation of abnormal intracellular proteins and their cell-to-cell transmission in order to stop, or at least slow, the progression of these diseases.",27916654,,10.1016/j.pharmthera.2016.11.010,34,Pharmacology & therapeutics,7905840,13.4,0.38577955961227417,0.8193979933110368,0.9431438127090301,3.075347334429572
The contribution of DNA methylation to the (dys)function of oligodendroglia in neurodegeneration,"Neurodegenerative diseases encompass a heterogeneous group of conditions characterised by the progressive degeneration of the structure and function of the central or peripheral nervous systems. The pathogenic mechanisms underlying these diseases are not fully understood. However, a central feature consists of regional aggregation of proteins in the brain, such as the accumulation of β-amyloid plaques in Alzheimer's disease (AD), inclusions of hyperphosphorylated microtubule-binding tau in AD and other tauopathies, or inclusions containing α-synuclein in Parkinson's disease (PD), dementia with Lewy bodies (DLB) and multiple system atrophy (MSA). Various pathogenic mechanisms are thought to contribute to disease, and an increasing number of studies implicate dysfunction of oligodendrocytes (the myelin producing cells of the central nervous system) and myelin loss. Aberrant DNA methylation, the most widely studied epigenetic modification, has been associated with many neurodegenerative diseases, including AD, PD, DLB and MSA, and recent findings highlight aberrant DNA methylation in oligodendrocyte/myelin-related genes. Here we briefly review the evidence showing that changes to oligodendrocytes and myelin are key in neurodegeneration, and explore the relevance of DNA methylation in oligodendrocyte (dys)function. As DNA methylation is reversible, elucidating its involvement in pathogenic mechanisms of neurodegenerative diseases and in dysfunction of specific cell-types such as oligodendrocytes may bring opportunities for therapeutic interventions for these diseases.",37386505,PMC10311741,10.1186/s40478-023-01607-9,2,Acta neuropathologica communications,101610673,7.578,0.38110437989234924,0.22073578595317725,0.782608695652174,1.788409785126045
A Bird's-Eye View of the Multiple Biochemical Mechanisms that Propel Pathology of Alzheimer's Disease: Recent Advances and Mechanistic Perspectives on How to Halt the Disease Progression Targeting Multiple Pathways,"Neurons consume the highest amount of oxygen, depend on oxidative metabolism for energy, and survive for the lifetime of an individual. Therefore, neurons are vulnerable to death caused by oxidative-stress, accumulation of damaged and dysfunctional proteins and organelles. There is an exponential increase in the number of patients diagnosed with neurodegenerative diseases such as Alzheimer's (AD) as the number of elderly increases exponentially. Development of AD pathology is a complex phenomenon characterized by neuronal death, accumulation of extracellular amyloid-β plaques and neurofibrillary tangles, and most importantly loss of memory and cognition. These pathologies are most likely caused by mechanisms including oxidative stress, mitochondrial dysfunction/stress, accumulation of misfolded proteins, and defective organelles due to impaired proteasome and autophagy mechanisms. Currently, there are no effective treatments to halt the progression of this disease. In order to treat this complex disease with multiple biochemical pathways involved, a complex treatment regimen targeting different mechanisms should be investigated. Furthermore, as AD is a progressive disease-causing morbidity over many years, any chemo-modulator for treatment must be used over long period of time. Therefore, treatments must be safe and non-interfering with other processes. Ideally, a treatment like medicinal food or a supplement that can be taken regularly without any side effect capable of reducing oxidative stress, stabilizing mitochondria, activating autophagy or proteasome, and increasing energy levels of neurons would be the best solution. This review summarizes progress in research on different mechanisms of AD development and some of the potential therapeutic development strategies targeting the aforementioned pathologies.",31127770,PMC6598003,10.3233/JAD-181230,8,Journal of Alzheimer's disease : JAD,9814863,4.16,0.37376153469085693,0.4682274247491639,0.3745819397993311,1.149902405764347
Chaperoning shape-shifting tau in disease,"Many neurodegenerative diseases, including Alzheimer's, originate from the conversion of proteins into pathogenic conformations. The microtubule-associated protein tau converts into β-sheet-rich amyloid conformations, which underlie pathology in over 25 related tauopathies. Structural studies of tau amyloid fibrils isolated from human tauopathy tissues have revealed that tau adopts diverse structural polymorphs, each linked to a different disease. Molecular chaperones play central roles in regulating tau function and amyloid assembly in disease. New data supports the model that chaperones selectively recognize different conformations of tau to limit the accumulation of proteotoxic species. The challenge now is to understand how chaperones influence disease processes across different tauopathies, which will help guide the development of novel conformation-specific diagnostic and therapeutic strategies.",35045944,,10.1016/j.tibs.2021.12.009,8,Trends in biochemical sciences,7610674,14.264,0.3643251061439514,0.47157190635451507,0.9464882943143813,3.165709444957274
Mitochondria as a target for neuroprotection: implications for Alzheimer´s disease,"Alzheimer's disease (AD), the most common form of dementia, is marked by progressive loss of memory and impairment of cognitive ability. Despite decades of intensive research and scientific advances, the intricate pathogenic mechanisms of AD are still not fully understood and, consequently, an effective treatment is yet to be developed. As widely accepted, the alterations of mitochondrial function are actively engaged in a plethora of neurodegenerative diseases, including AD. With growing interest in the mitochondria as a potential target for understanding AD, it has even been hypothesized that deficits in these organelles may be at the heart of the progression of AD itself. Areas covered: The purpose of this review is to summarize relevant studies that suggest a role for mitochondrial (dys)function in AD and to provide a survey on latest developments regarding AD-related mitochondrial therapeutics. Expert commentary: As outlined in a plethora of studies, there is no doubt that mitochondria play a major role in several stages of AD progression. Even though more in-depth studies are needed before pharmaceutical industry can apply such knowledge to human medicine, the continuous advances in AD research field will certainly facilitate and accelerate the development of more effective preventive or therapeutic strategies to fight this devastating disease.",27366815,,10.1080/14737175.2016.1205488,14,Expert review of neurotherapeutics,101129944,4.287,0.3624049127101898,0.6153846153846154,0.44481605351170567,1.197919870703037
The DNA Methylation in Neurological Diseases,"DNA methylation is critical for the normal development and functioning of the human brain, such as the proliferation and differentiation of neural stem cells, synaptic plasticity, neuronal reparation, learning, and memory. Despite the physical stability of DNA and methylated DNA compared to other epigenetic modifications, some DNA methylation-based biomarkers have translated into clinical practice. Increasing reports indicate a strong association between DNA methylation profiles and various clinical outcomes in neurological diseases, making DNA methylation profiles valuable as novel clinical markers. In this review, we aim to discuss the latest evidence concerning DNA methylation alterations in the development of neurodegenerative, neurodevelopmental, and neuropsychiatric diseases. We also highlighted the relationship of DNA methylation alterations with the disease progression and outcome in many neurological diseases such as Alzheimer's disease, Parkinson's disease, amyotrophic lateral sclerosis, frontotemporal dementia, and autism.",36359835,PMC9657829,10.3390/cells11213439,14,Cells,101600052,7.666,0.35958901047706604,0.6187290969899666,0.8160535117056856,1.872699225684233
[A new paradigm for the development of neurodegenerative diseases on the example of Alzheimer's disease and Parkinson's disease],"The role of neuronal inflammation developing during the formation of amyloid plaques and Lewy bodies has been investigated. The influence of various exogenous and endogenous factors on the development of neuroinflammation has been established, but the role of various infectious agents in the development of this process has been much less studied. Today, the existence of a universal trigger mechanism of the neurodegenerative process is obvious: a specific pathogen of a bacterial or viral nature (including a long-term persistent in the nervous tissue in a latent state), reactivating, penetrates into certain cerebral structures, where it is influenced by either Aβ or resident macrophages of the central nervous system, which, in turn, are activated and induce the release of pro-inflammatory cytokines, leading to the development of neuronal inflammation, autophagy and neurodegeneration. Reactivation of latent, such as herpes, infection in individuals who are carriers of APOE4 significantly increases the risk of developing Alzheimer's disease. Class II genes of the HLA locus (HLA II) may be related to the progression of neurodegenerative diseases. The increase in iron levels in the glia is induced by inflammation, which leads to neurodegeneration. Disruption of the homeostasis of redox-active metals, iron and copper, is an integral part of the pathogenesis of Alzheimer's disease and Parkinson's disease. The developing neuroinflammation leads to the intensification of the processes of peroxidation, oxidation of metals and the development of ferroptosis.",35727933,,,0,Advances in gerontology = Uspekhi gerontologii,100971443,0.0,0.3544330596923828,0.03678929765886288,0.05016722408026756,0.22001769534720225
Complex and differential glial responses in Alzheimer's disease and ageing,"Glial cells and their association with neurones are fundamental for brain function. The emergence of complex neurone-glial networks assures rapid information transfer, creating a sophisticated circuitry where both types of neural cells work in concert, serving different activities. All glial cells, represented by astrocytes, oligodendrocytes, microglia and NG2-glia, are essential for brain homeostasis and defence. Thus, glia are key not only for normal central nervous system (CNS) function, but also to its dysfunction, being directly associated with all forms of neuropathological processes. Therefore, the progression and outcome of neurological and neurodegenerative diseases depend on glial reactions. In this review, we provide a concise account of recent data obtained from both human material and animal models demonstrating the pathological involvement of glia in neurodegenerative processes, including Alzheimer's disease (AD), as well as physiological ageing.",26923267,,10.2174/1567205013666160229112911,38,Current Alzheimer research,101208441,3.04,0.35365137457847595,0.8394648829431438,0.27424749163879597,0.9880838013357144
Role of neurotoxicants in the pathogenesis of Alzheimer's disease: a mechanistic insight,"Alzheimer's disease (AD) is the most conspicuous chronic neurodegenerative syndrome, which has become a significant challenge for the global healthcare system. Multiple studies have corroborated a clear association of neurotoxicants with AD pathogenicity, such as Amyloid beta (Aβ) proteins and neurofibrillary tangles (NFTs), signalling pathway modifications, cellular stress, cognitive dysfunctions, neuronal apoptosis, neuroinflammation, epigenetic modification, and so on. This review, therefore, aimed to address several essential mechanisms and signalling cascades, including Wnt (wingless and int.) signalling pathway, autophagy, mammalian target of rapamycin (mTOR), protein kinase C (PKC) signalling cascades, cellular redox status, energy metabolism, glutamatergic neurotransmissions, immune cell stimulations (e.g. microglia, astrocytes) as well as an amyloid precursor protein (APP), presenilin-1 (PSEN1), presenilin-2 (PSEN2) and other AD-related gene expressions that have been pretentious and modulated by the various neurotoxicants. This review concluded that neurotoxicants play a momentous role in developing AD through modulating various signalling cascades. Nevertheless, comprehension of this risk agent-induced neurotoxicity is far too little. More in-depth epidemiological and systematic investigations are needed to understand the potential mechanisms better to address these neurotoxicants and improve approaches to their risk exposure that aid in AD pathogenesis.Key messagesInevitable cascade mechanisms of how Alzheimer's Disease-related (AD-related) gene expressions are modulated by neurotoxicants have been discussed.Involvement of the neurotoxicants-induced pathways caused an extended risk of AD is explicited.Integration of cell culture, animals and population-based analysis on the clinical severity of AD is addressed.",34433343,PMC8405119,10.1080/07853890.2021.1966088,4,Annals of medicine,8906388,5.348,0.3509773313999176,0.35451505016722407,0.5618729096989966,1.3510894088733953
Shared and disease-specific glial gene expression changes in neurodegenerative diseases,"We found evolutionarily conserved astrocyte and microglia subpopulations shared across multiple brain regions. We reveal similarities and differences between Alzheimer's disease glia and Parkinson's disease glia, as well as regional variance linked to disease pathology and neurodegeneration.",36993868,PMC10046492,10.1038/s43587-023-00378-1,3,Nature aging,101773306,0.0,0.35053253173828125,0.3010033444816054,0.05351170568561873,0.27052018793928984
"Catechol-O-methyltransferase, Cognition and Alzheimer's Disease","Objective:Cognition is a complex trait representing a set of all mental abilities and processes related to knowledge. Although diverse brain regions are involved, most cognitive processes appear to engage cortical regions. The activity of dopaminergic neurons in prefrontal cortex represents a biological substrate underlying cognitive functions. Alzheimer's Disease (AD) is the most frequent dementia associated with cognitive impairments. Cognitive impairment in AD starts slowly with discrete deterioration in memory, language, thinking and reasoning, but it progresses into more severe and debilitating cognitive dysfunction. Cognitive function is affected by the complex interactions between various genetic, epigenetic, developmental and environmental factors. One of the most studied genes, associated with cognitive disturbances, is the gene coding for Catechol-O-methyltransferase (COMT), the enzyme with major role in dopamine metabolism and modulation of different brain functions. Therefore, COMT is studied as a target for many neuropsychiatric disorders, including dementias and AD. The COMT Val158/108Met functional polymorphism affects significantly the enzyme activity and consequently cognitive performance associated with altered dopamine function. The association of COMT Val158/108Met polymorphism with some cognitive domains and psychosis in AD was reported in some but not in all studies. Besides COMT Val158/108Met polymorphism, other risk genotypes or haplotypes should be evaluated to determine the association of COMT with cognitive decline in AD.Conclusion:Better understanding of the role of COMT in cognitive processes in AD, as well as integration of neurobiological, genetic, genomic and epigenetic data, might help in developing new potential therapies of cognitive impairments and psychotic symptoms, characteristic features of AD.",29231139,,10.2174/1567205015666171212094229,18,Current Alzheimer research,101208441,3.04,0.34975481033325195,0.6755852842809364,0.27759197324414714,0.9529699430561385
