Title,Abstract,PMID,PMCID,DOI,Cited Number,journal_title,Journal_id,impact_factor,relevance_score,cited_Normalized,impact_Normalized,final_score
Capturing Measures That Matter: The Potential Value of Digital Measures of Physical Behavior for Alzheimer's Disease Drug Development,"Alzheimer's disease (AD) is a devastating neurodegenerative disease and the primary cause of dementia worldwide. Despite the magnitude of AD's impact on patients, caregivers, and society, nearly all AD clinical trials fail. A potential contributor to this high rate of failure is that established clinical outcome assessments fail to capture subtle clinical changes, entail high burden for patients and their caregivers, and ineffectively address the aspects of health deemed important by patients and their caregivers. AD progression is associated with widespread changes in physical behavior that have impacts on the ability to function independently, which is a meaningful aspect of health for patients with AD and important for diagnosis. However, established assessments of functional independence remain underutilized in AD clinical trials and are limited by subjective biases and ceiling effects. Digital measures of real-world physical behavior assessed passively, continuously, and remotely using digital health technologies have the potential to address some of these limitations and to capture aspects of functional independence in patients with AD. In particular, measures of real-world gait, physical activity, and life-space mobility captured with wearable sensors may offer value. Additional research is needed to understand the validity, feasibility, and acceptability of these measures in AD clinical research.",37545234,PMC10578291,10.3233/JAD-230152,0,Journal of Alzheimer's disease : JAD,9814863,4.16,0.19406214356422424,0.09698996655518395,0.4214046822742475,0.9678352794495714
Current Views on the Role of Stress in the Pathogenesis of Chronic Neurodegenerative Diseases,"The review summarizes the results of studies on the cellular and molecular mechanisms mediating the impact of stress on the pathogenesis of neurodegenerative brain pathologies (Alzheimer's disease, Parkinson's disease, etc.) and presents current information on the role of stress in the hyperphosphorylation of tau protein, aggregation of beta-amyloid, and hyperactivation of the hypothalamic-pituitary-adrenal axis involved in the hyperproduction of factors that contribute to the pathogenetic role of stress in neurodegeneration. The data on the participation of microglia in the effects of stress on the pathogenesis of neurodegenerative diseases are presented.",34225596,,10.1134/S0006297921060110,0,Biochemistry. Biokhimiia,0376536,0.0,0.1937568634748459,0.10033444816053512,0.1605351170568562,0.13632100771701455
Microglia in Alzheimer's disease,"Microglia are brain-resident myeloid cells that mediate key functions to support the CNS. Microglia express a wide range of receptors that act as molecular sensors, which recognize exogenous or endogenous CNS insults and initiate an immune response. In addition to their classical immune cell function, microglia act as guardians of the brain by promoting phagocytic clearance and providing trophic support to ensure tissue repair and maintain cerebral homeostasis. Conditions associated with loss of homeostasis or tissue changes induce several dynamic microglial processes, including changes of cellular morphology, surface phenotype, secretory mediators, and proliferative responses (referred to as an ""activated state""). Activated microglia represent a common pathological feature of several neurodegenerative diseases, including Alzheimer's disease (AD). Cumulative evidence suggests that microglial inflammatory activity in AD is increased while microglial-mediated clearance mechanisms are compromised. Microglia are perpetually engaged in a mutual interaction with the surrounding environment in CNS; thus, diverse microglial reactions at different disease stages may open new avenues for therapeutic intervention and modification of inflammatory activities. In this Review, the role of microglia in the pathogenesis of AD and the modulation of microglia activity as a therapeutic modality will be discussed.",28862638,PMC5669553,10.1172/JCI90606,395,The Journal of clinical investigation,7802877,19.456,0.193451926112175,0.9866220735785953,0.9933110367892977,4.204595570383024
Effects of Exercise Training on Immune-Related Genes and Pathways in the Cortex of Animal Models of Alzheimer's Disease: A Systematic Review,"Background:Alzheimer's disease (AD) is a chronic neurodegenerative disease that affects the immune system due to the accumulation of amyloid-β (Aβ) and tau associated molecular pathology and other pathogenic processes. To address AD pathogenesis, various approaches had been conducted from drug development to lifestyle modification to reduce the prevalence of AD. Exercise is considered a prominent lifestyle modification to combat AD.Objective:This observation prompted us to review the literature on exercise related to immune genes in the cortex of animal models of AD. We focused on animal model studies due to their prevalence in this domain.Methods:The systematic review was conducted according to PRISMA standards using Web of Science (WoS) and PubMed databases. Any kind of genes, proteins, and molecular molecules were included in this systematic review. The list of these immune-related molecules was analyzed in the STRING database for functional enrichment analysis.Results:We found that 17 research studies discussed immune-related molecules and 30 immune proteins. These studies showed that exercise had the ability to ameliorate dysfunction in AD-related pathways, which led to decreasing the expression of microglia-related pathways and Th17-related immune pathways. As a result of decreasing the expression of immune-related pathways, the expression of apoptosis-related pathways was also decreasing, and neuronal survival was increased by exercise activity.Conclusions:Based on functional enrichment analysis, exercise not only could reduce apoptotic factors and immune components but also could increase cell survival and Aβ clearance in cortex samples. PROSPERO ID: CRD42022326093.",38578886,,10.3233/JAD-230803,0,Journal of Alzheimer's disease : JAD,9814863,4.16,0.19329959154129028,0.10367892976588629,0.42474916387959866,0.9687155408779514
Dysfunction of the neurovascular unit in diabetes-related neurodegeneration,"In current aging societies, diabetes mellitus and neurodegenerative diseases represented by Alzheimer's disease are highly prevalent among adults, especially the elderly all over the world. It is worth noting that a substantial body of evidence suggests diabetes contributes to accelerated neurodegenerative processes and the decline of cognition. Over the last few years, some studies have indicated neurovascular uncoupling and disrupted functional connectivity in the early stages of many neurodegenerative diseases, and the concept of the neurovascular unit (NVU) has been highlighted to understand the initiation and progression of neurodegenerative diseases recently. Considering that some components of the NVU are also demonstrated to have abnormal morphology and function under the condition of diabetes, we propose the hypothesis that diabetes may promote the onset and development of neurodegenerative diseases by impairing the integrity of the NVU, named Diabetes-NVU-Neurodegeneration Hypothesis. The existing body of literature supporting the hypothesis and elucidating the underlying mechanisms will be summarized in this review.",32841897,,10.1016/j.biopha.2020.110656,12,Biomedicine & pharmacotherapy = Biomedecine & pharmacotherapie,8213295,7.419,0.19314736127853394,0.5785953177257525,0.7692307692307693,1.7154074803122707
Investigating hypotheses of neurodegeneration by learning dynamical systems of protein propagation in the brain,"We introduce a theoretical framework for estimating, comparing and interpreting mechanistic hypotheses on long term protein propagation across brain networks in neurodegenerative disorders (ND). The model is expressed within a Bayesian non-parametric regression setting, where mechanisms of protein dynamics are inferred by means of gradient matching on dynamical systems (DS). The Bayesian formalism, combined with stochastic variational inference, naturally allows for model comparison via assessment of model evidence, while providing uncertainty quantification of causal relationship underlying protein progressions. When applied to in-vivo AV45-PET brain imaging data measuring topographic amyloid deposition in Alzheimer's disease (AD), our model identified the mechanisms of accumulation, clearance and propagation as the best suited DS for bio-mechanical description of amyloid dynamics in AD, enabling realistic and accurate personalized simulation of amyloidosis.",33823273,,10.1016/j.neuroimage.2021.117980,3,NeuroImage,9215515,7.4,0.19284319877624512,0.32441471571906355,0.7625418060200669,1.66058886240956
Microglial Progranulin: Involvement in Alzheimer's Disease and Neurodegenerative Diseases,"Neurodegenerative diseases such as Alzheimer's disease have proven resistant to new treatments. The complexity of neurodegenerative disease mechanisms can be highlighted by accumulating evidence for a role for a growth factor, progranulin (PGRN). PGRN is a glycoprotein encoded by the GRN/Grn gene with multiple cellular functions, including neurotrophic, anti-inflammatory and lysosome regulatory properties. Mutations in the GRN gene can lead to frontotemporal lobar degeneration (FTLD), a cause of dementia, and neuronal ceroid lipofuscinosis (NCL), a lysosomal storage disease. Both diseases are associated with loss of PGRN function resulting, amongst other features, in enhanced microglial neuroinflammation and lysosomal dysfunction. PGRN has also been implicated in Alzheimer's disease (AD). Unlike FTLD, increased expression of PGRN occurs in brains of human AD cases and AD model mice, particularly in activated microglia. How microglial PGRN might be involved in AD and other neurodegenerative diseases will be discussed. A unifying feature of PGRN in diseases might be its modulation of lysosomal function in neurons and microglia. Many experimental models have focused on consequences of PGRN gene deletion: however, possible outcomes of increasing PGRN on microglial inflammation and neurodegeneration will be discussed. We will also suggest directions for future studies on PGRN and microglia in relation to neurodegenerative diseases.",30862089,PMC6468562,10.3390/cells8030230,33,Cells,101600052,7.666,0.19253936409950256,0.8160535117056856,0.8327759197324415,1.8119343208008387
Abnormal Structural Brain Connectome in Individuals with Preclinical Alzheimer's Disease,"Alzheimer's disease has a long preclinical phase during which amyloid pathology and neurodegeneration accumulate in the brain without producing overt cognitive deficits. It is currently unclear whether these early disease stages are associated with a progressive disruption in the communication between brain regions that subsequently leads to cognitive decline and dementia. In this study we assessed the organization of structural networks in cognitively normal (CN) individuals harboring amyloid pathology (A+N-), neurodegeneration (A-N+), or both (A+N+) from the prospective and longitudinal Swedish BioFINDER study. We combined graph theory with diffusion tensor imaging to investigate integration, segregation, and centrality measures in the brain connectome in the previous groups. At baseline, our findings revealed a disrupted network topology characterized by longer paths, lower efficiency, increased clustering and modularity in CN A-N+ and CN A+N+, but not in CN A+N-. After 2 years, CN A+N+ showed significant abnormalities in all global network measures, whereas CN A-N+ only showed abnormalities in the global efficiency. Network connectivity and organization were associated with memory in CN A+N+ individuals. Altogether, our findings suggest that amyloid pathology is not sufficient to disrupt structural network topology, whereas neurodegeneration is.",29028937,,10.1093/cercor/bhx236,19,"Cerebral cortex (New York, N.Y. : 1991)",9110718,4.861,0.19208428263664246,0.6923076923076923,0.5117056856187291,1.225912108043524
ALZHEIMER'S DISEASE AND ITS RELATIONSHIP WITH THE MICROBIOTA-GUT-BRAIN AXIS,"Background:Alzheimer's disease (AD) is a progressive and irreversible neurodegenerative disease, characterized by the accumulation of amyloid plaques and neurofibrillary tangles in the brain. Several pathways enable bidirectional communication between the central nervous system (CNS), the intestine and its microbiota, constituting the microbiota-gut-brain axis.Objective:Review the pathophysiology of AD, relate it to the microbiota-gut-brain axis and discuss the possibility of using probiotics in the treatment and/or prevention of this disease.Methods:Search of articles from the PubMed database published in the last 5 years (2017 to 2022) structure the narrative review.Results:The composition of the gut microbiota influences the CNS, resulting in changes in host behavior and may be related to the development of neurodegenerative diseases. Some metabolites produced by the intestinal microbiota, such as trimethylamine N-oxide (TMAO), may be involved in the pathogenesis of AD, while other compounds produced by the microbiota during the fermentation of food in the intestine, such as D-glutamate and fatty acids short chain, are beneficial in cognitive function. The consumption of live microorganisms beneficial to health, known as probiotics, has been tested in laboratory animals and humans to evaluate the effect on AD.Conclusion:Although there are few clinical trials evaluating the effect of probiotic consumption in humans with AD, the results to date indicate a beneficial contribution of the use of probiotics in this disease.",37194773,,10.1590/S0004-2803.202301000-17,2,Arquivos de gastroenterologia,15310600R,0.0,0.1911766231060028,0.2709030100334448,0.16387959866220736,0.16888657587029066
"The Immune System and Neuroinflammation as Potential Sources of Blood-Based Biomarkers for Alzheimer's Disease, Parkinson's Disease, and Huntington's Disease","Neurodegenerative diseases are characterized by a loss of neurons that leads to cognitive and behavioral dysfunction. Alzheimer's disease (AD) is the most common neurodegenerative disorder affecting millions of people in the United States and worldwide, followed by Parkinson's disease (PD). While some early onset forms of AD and PD are hereditary, the sporadic or late-onset cases are believed to result from lifestyle and environmental factors. On the contrary, Huntington's disease (HD) is a neurodegenerative disease solely caused by mutations in the gene for huntingtin protein. The disease mechanisms at play for all three disorders remain elusive, hampering efforts to develop effective therapeutic interventions. In light of this, the discovery of robust biomarkers is crucial in order to identify people at risk for AD and PD, preferably before symptoms arise. For all three diseases, the identification of biomarkers would not only allow development of treatments but also evaluation and adjustment of these with disease progression. It is now understood that neuroinflammation plays a crucial role in neurodegenerative diseases, along with subsequent immune activation. Therefore, research is actively ongoing to discover and evaluate inflammatory and immune-related biomarkers. Recent progress in this area for AD, PD, and HD is presented here.",27046268,,10.1021/acschemneuro.6b00042,28,ACS chemical neuroscience,101525337,5.78,0.19102567434310913,0.782608695652174,0.5953177257525084,1.4271371437363003
A mathematical model on the propagation of tau pathology in neurodegenerative diseases,"A system of partial differential equations is developed to study the spreading of tau pathology in the brain for Alzheimer's and other neurodegenerative diseases. Two cases are considered with one assuming intracellular diffusion through synaptic activities or the nanotubes that connect the adjacent cells. The other, in addition to intracellular spreading, takes into account of the secretion of the tau species which are able to diffuse, move with the interstitial fluid flow and subsequently taken up by the surrounding cells providing an alternative pathway for disease spreading. Cross membrane transport of the tau species are considered enabling us to examine the role of extracellular clearance of tau protein on the disease status. Bifurcation analysis is carried out for the steady states of the spatially homogeneous system yielding the results that fast cross-membrane transport combined with effective extracellular clearance is key to maintain the brain's healthy status. Numerical simulations of the first case exhibit solutions of travelling wave form describing the gradual outward spreading of the pathology; whereas the second case shows faster spreading with the buildup of neurofibrillary tangles quickly elevated throughout. Our investigation thus indicates that the gradual progression of the intracellular spreading case is more consistent with the clinical observations of the development of Alzheimer's disease.",38750128,,10.1007/s00285-024-02101-z,0,Journal of mathematical biology,7502105,2.164,0.19087480008602142,0.10702341137123746,0.23411371237458195,0.5687295623258604
Biomarkers for Managing Neurodegenerative Diseases,"Neurological disorders are the leading cause of cognitive and physical disability worldwide, affecting 15% of the global population. Due to the demographics of aging, the prevalence of neurological disorders, including neurodegenerative diseases, will double over the next two decades. Unfortunately, while available therapies provide symptomatic relief for cognitive and motor impairment, there is an urgent unmet need to develop disease-modifying therapies that slow the rate of pathological progression. In that context, biomarkers could identify at-risk and prodromal patients, monitor disease progression, track responses to therapy, and parse the causality of molecular events to identify novel targets for further clinical investigation. Thus, identifying biomarkers that discriminate between diseases and reflect specific stages of pathology would catalyze the discovery and development of therapeutic targets. This review will describe the prevalence, known mechanisms, ongoing or recently concluded therapeutic clinical trials, and biomarkers of three of the most prevalent neurodegenerative diseases, including Alzheimer's disease (AD), amyotrophic lateral sclerosis (ALS), and Parkinson's disease (PD).",38672416,PMC11048498,10.3390/biom14040398,0,Biomolecules,101596414,6.064,0.19072403013706207,0.11036789297658862,0.6153846153846154,1.349307996677555
Caspases: therapeutic targets in neurologic disease,"Specific therapies for neurologic diseases such as Alzheimer's disease provide the potential for better clinical outcomes. Expression of caspases in the brain is developmentally regulated, and dysregulated in neurologic disease, supporting that caspases may be therapeutic targets. The activity of caspases is carefully regulated via binding partners, cleavage, or endogenous inhibitors to prevent spontaneous activation, which could lead to aberrant cell death. This review serves as a brief examination of the current understanding of the regulation and function of caspases, and approaches to specifically target aberrant caspase activity. The use of proper tools to investigate individual caspases is addressed. Moreover, it summarizes the reports of various caspases in Alzheimer's disease studies. A better understanding of specific caspase pathways in heath and neurodegenerative disease is crucial for identifying specific targets for the development of therapeutic interventions.",25339539,PMC4322071,10.1007/s13311-014-0307-9,17,Neurotherapeutics : the journal of the American Society for Experimental,101290381,6.088,0.1905733346939087,0.6588628762541806,0.6220735785953178,1.4637165760671813
Low levels of aluminum can lead to behavioral and morphological changes associated with Alzheimer's disease and age-related neurodegeneration,"Aluminum (Al) is a very common component of the earth's mineral composition. It is not essential element for life and is a constituent of rather inert minerals. Therefore, it has often been regarded as not presenting a significant health hazard. As a result, aluminum-containing agents been used in the preparation of many foodstuffs processing steps and also in elimination of particulate organic matter from water. More recently, the reduced pH of bodies of water resulting from acid rain has led to mobilization of aluminum-containing minerals into a more soluble form, and these have thus entered residential drinking water resources. By this means, the body burden of aluminum in humans has increased. Epidemiological and experimental findings indicate that aluminum is not as harmless as was previously thought, and that aluminum may contribute to the inception and advancement of Alzheimer's disease. Epidemiological data is reinforced by indications that aluminum exposure can result in excess inflammatory activity within the brain. Activation of the immune system not initiated by an infectious agent, typifies the aging brain and is even more augmented in several neurodegenerative diseases. The origin of most age-related neurological disorders is generally not known but as they are largely not of genetic derivation, their development is likely triggered by unknown environmental factors. There is a growing and consistent body of evidence that points to aluminum as being one such significant influence. Evidence is presented that reinforces the likelihood that aluminum is a factor speeding the rate of brain aging. Such acceleration would inevitably enlarge the incidence of age-related neurological diseases.",26687397,,10.1016/j.neuro.2015.12.002,51,Neurotoxicology,7905589,4.398,0.1905733346939087,0.9063545150501672,0.46153846153846156,1.1752149038263786
Biological Basis for Amyloidogenesis in Alzheimer's Disease,"Certain cellular proteins normally soluble in the living organism under certain conditions form aggregates with a specific cross-β sheet structure called amyloid. These intra- or extracellular insoluble aggregates (fibers or plaques) are hallmarks of many neurodegenerative pathologies including Alzheimer's disease (AD), Huntington's disease, Parkinson's disease, prion disease, and other progressive neurological diseases that develop in the aging human central nervous system. Amyloid diseases (amyloidoses) are widespread in the elderly human population, a rapidly expanding demographic in many global populations. Increasing age is the most significant risk factor for neurodegenerative diseases associated with amyloid plaques. To date, nearly three dozen different misfolded proteins targeting brain and other organs have been identified in amyloid diseases and AD, the most prevalent neurodegenerative amyloid disease affecting over 15 million people worldwide. Here we (i) highlight the latest data on mechanisms of amyloid formation and further discuss a hypothesis on the amyloid cascade as a primary mechanism of AD pathogenesis and (ii) review the evolutionary aspects of amyloidosis, which allow new insight on human-specific mechanisms of dementia development.",28320296,,10.1134/S0006297917020043,14,Biochemistry. Biokhimiia,0376536,0.0,0.19042274355888367,0.6321070234113713,0.16722408026755853,0.24067505081760446
miRNAs Identify Shared Pathways in Alzheimer's and Parkinson's Diseases,"Despite the identification of several dozens of common genetic variants associated with Alzheimer's disease (AD) and Parkinson's disease (PD), most of the genetic risk remains uncharacterised. Therefore, it is important to understand the role of regulatory elements, such as miRNAs. Dysregulated miRNAs are implicated in AD and PD, with potential value in dissecting the shared pathophysiology between the two disorders. miRNAs relevant to both neurodegenerative diseases are related to axonal guidance, apoptosis, and inflammation, therefore, AD and PD likely arise from similar underlying biological pathway defects. Furthermore, pathways regulated by APP, L1CAM, and genes of the caspase family may represent promising therapeutic miRNA targets in AD and PD since they are targeted by dysregulated miRNAs in both disorders.",31221572,,10.1016/j.molmed.2019.05.006,20,Trends in molecular medicine,100966035,15.272,0.1901218295097351,0.7157190635451505,0.9531772575250836,3.311616910414871
