Title,Abstract,PMID,PMCID,DOI,Cited Number,journal_title,Journal_id,impact_factor,relevance_score,cited_Normalized,impact_Normalized,final_score
Neuroinflammation in Alzheimer's disease: Current evidence and future directions,"Several attempts have been made to treat Alzheimer's disease (AD) using anti-amyloid strategies with disappointing results. It is clear that the ""amyloid cascade hypothesis"" alone cannot fully explain the neuronal damage in AD, as evidenced both by autopsy and imaging studies. Neuroinflammation plays a significant role in neurodegenerative diseases, whereas the debate is ongoing about its precise role, whether it is protective or harmful. In this review, we focus on the potential mechanism of glial activation and how local and systemic factors influence disease progression. We focus on neuroinflammation in AD, especially in the earliest stages, a vicious cycle of glial priming, release of pro-inflammatory factors, and neuronal damage. We review the evidence from imaging studies, regarding the temporal relationship between amyloid deposition and neuroinflammation, the influence of systemic inflammation on glial activation, both in acute and chronic stimulation and the relevance of inflammation as a diagnostic and therapeutic target.",27179961,,10.1016/j.jalz.2016.02.010,614,Alzheimer's & dementia : the journal of the Alzheimer's Association,101231978,16.655,0.23775286972522736,0.9899665551839465,0.9632107023411371,3.6716450328719263
Palmitoylation in Alzheimer's disease and other neurodegenerative diseases,"Posttranslational modifications of proteins are important regulatory processes endowing the proteins functional complexity. Over the last decade, numerous studies have shed light on the roles of palmitoylation, one of the most common lipid modifications, in various aspects of neuronal functions. Major players regulating palmitoylation are the enzymes that mediate palmitoylation and depalmitoylation which are palmitoyl acyltransferases (PATs) and protein thioesterases, respectively. In this review, we will provide and discuss current understandings on palmitoyation/depalmitoylation control mediated by PATs and/or protein thioesterases for neuronal functions in general and also for Alzheimer's disease in particular, and other neurodegenerative diseases such as Huntington's disease, schizophrenia and intellectual disability.",27293050,,10.1016/j.phrs.2016.06.008,59,Pharmacological research,8907422,10.334,0.23757591843605042,0.9230769230769231,0.903010033444816,2.393960935677015
Emerging therapeutic developments in neurodegenerative diseases: A clinical investigation,"Despite a century of intensive research, there is still a lack of disease-modifying treatments for neurodegenerative diseases that pose a threat to human society. A well-documented knowledge and resource gap has impeded the translation of fundamental research into promising therapies. In addition, the analysis of extensive preclinical data to allow the improved selection of therapeutic technologies and clinical candidates for further development is challenging. To address this need, we describe technologies that have emerged over the past decade that have enabled the development of novel, high-quality, cost-effective treatments for major neurodegenerative diseases, including Alzheimer's disease and Parkinson's disease. Moreover, we benchmark emerging technologies that have been adopted by top pharmaceutical companies looking to bridge the gap between drug discovery and drug development in neurodegenerative disease.",35728774,,10.1016/j.drudis.2022.06.005,6,Drug discovery today,9604391,8.369,0.23739908635616302,0.4180602006688963,0.862876254180602,1.8998514919474772
"Pineal gland dysfunction in Alzheimer's disease: relationship with the immune-pineal axis, sleep disturbance, and neurogenesis","Alzheimer's disease (AD) is a globally common neurodegenerative disease, which is accompanied by alterations to various lifestyle patterns, such as sleep disturbance. The pineal gland is the primary endocrine organ that secretes hormones, such as melatonin, and controls the circadian rhythms. The decrease in pineal gland volume and pineal calcification leads to the reduction of melatonin production. Melatonin has been reported to have multiple roles in the central nervous system (CNS), including improving neurogenesis and synaptic plasticity, suppressing neuroinflammation, enhancing memory function, and protecting against oxidative stress. Recently, reduced pineal gland volume and pineal calcification, accompanied by cognitive decline and sleep disturbances have been observed in AD patients. Here, I review current significant evidence of the contribution of pineal dysfunction in AD to the progress of AD neuropathology. I suggest new insights to understanding the relationship between AD pathogenesis and pineal gland function.",31296240,PMC6624939,10.1186/s13024-019-0330-8,24,Molecular neurodegeneration,101266600,18.879,0.23704566061496735,0.7391304347826086,0.9832775919732442,4.065853483325503
Current Concepts of Neurodegenerative Mechanisms in Alzheimer's Disease,"Neurodegenerative diseases are hereditary or sporadic conditions that result in the progressive loss of the structure and function of neurons as well as neuronal death. Although a range of diseases lie under this umbrella term, Alzheimer's disease (AD) and Parkinson's disease (PD) are the most common neurodegenerative diseases that affect a large population around the globe. Alzheimer's disease is characterized by the abnormal accumulation of extracellular amyloid-βplaques and intraneuronal neurofibrillary tangles in brain regions and manifests as a type of dementia in aged individuals that results in memory loss, multiple cognitive abnormalities, and intellectual disabilities that interfere with quality of life. Since the discovery of AD, a wealth of new information has emerged that delineates the causes, mechanisms of disease, and potential therapeutic agents, but an effective remedy to cure the diseases has not been identified yet. This could be because of the complexity of the disease process, as it involves various contributing factors that include environmental factors and genetic predispositions. This review summarizes the current understanding on neurodegenerative mechanisms that lead to the emergence of the pathology of AD.",29707568,PMC5863339,10.1155/2018/3740461,63,BioMed research international,101600173,3.246,0.23686911165714264,0.9297658862876255,0.3076923076923077,0.9772746442518108
Nutritional supplementation for Alzheimer's disease?,"Purpose of review:Evidence for the benefit of nutrition in Alzheimer's disease continues to accumulate. Many studies with individual vitamins or supplements show marginal, if any, benefit. However, new findings with combinatorial formulations demonstrate improvement in cognitive performance and behavioral difficulties that accompany Alzheimer's disease. Herein, we review some of the most recent clinical advances and summarize supportive preclinical studies.Recent findings:We present novel positive effects on Alzheimer's disease derived from diet, trace elements, vitamins and supplements. We discuss the inherent difficulty in conducting nutritional studies because of the variance in participants' nutritional history, versus pharmacological interventions in which participants are naive to the intervention. We examine the evidence that epigenetics play a role in Alzheimer's disease and how nutritional intervention can modify the key epigenetic events to maintain or improve cognitive performance.Summary:Overall consideration of the most recent collective evidence suggests that the optimal approach for Alzheimer's disease would seem to combine early, multicomponent nutritional approaches (a Mediterranean-style diet, multivitamins and key combinatorial supplements), along with lifestyle modifications such as social activity and mental and physical exercise, with ultimate addition of pharmacological agents when warranted.",25602242,,10.1097/YCO.0000000000000138,7,Current opinion in psychiatry,8809880,4.787,0.23651622235774994,0.44816053511705684,0.5050167224080268,1.1889418404380614
Trimethylamine N-Oxide Reduces Neurite Density and Plaque Intensity in a Murine Model of Alzheimer's Disease,"Background:Alzheimer's disease (AD) is the most common aging-associated neurodegenerative disease; nevertheless, the etiology and progression of the disease is still incompletely understood. We have previously shown that the microbially-derived metabolite trimethylamine N-oxide (TMAO) is elevated in the cerebrospinal fluid (CSF) of individuals with cognitive impairment due to AD and positively correlates with increases in CSF biomarkers for tangle, plaque, and neuronal pathology.Objective:We assessed the direct impact of TMAO on AD progression.Methods:To do so, transgenic 5XFAD mice were supplemented with TMAO for 12 weeks. Neurite density was assessed through quantitative brain microstructure imaging with neurite orientation dispersion and density imaging magnetic resonance imaging (MRI). Label-free, quantitative proteomics was performed on cortex lysates from TMAO-treated and untreated animals. Amyloid-β plaques, astrocytes, and microglia were assessed by fluorescent immunohistochemistry and synaptic protein expression was quantified via western blot.Results:Oral TMAO administration resulted in significantly reduced neurite density in several regions of the brain. Amyloid-β plaque mean intensity was reduced, while plaque count and size remained unaltered. Proteomics analysis revealed that TMAO treatment impacted the expression of 30 proteins (1.5-fold cut-off) in 5XFAD mice, including proteins known to influence neuronal health and amyloid-β precursor protein processing. TMAO treatment did not alter astrocyte and microglial response nor cortical synaptic protein expression.Conclusion:These data suggest that elevated plasma TMAO impacts AD pathology via reductions in neurite density.",36155509,PMC9881463,10.3233/JAD-220413,2,Journal of Alzheimer's disease : JAD,9814863,4.16,0.23616375029087067,0.25418060200668896,0.4013377926421405,1.0245343705758603
Retinoic Acid and the Gut Microbiota in Alzheimer's Disease: Fighting Back-to-Back?,"Background:There is growing evidence that the gut microbiota may play an important role in neurodegenerative diseases such as Alzheimer's disease. However, how these commensals influence disease risk and progression still has to be deciphered.Objective:The objective of this review was to summarize current knowledge on the interplay between gut microbiota and retinoic acid. The latter one represents one of the important micronutrients, which have been correlated to Alzheimer's disease and are used in initial therapeutic intervention studies.Methods:A selective overview of the literature is given with the focus on the function of retinoic acid in the healthy and diseased brain, its metabolism in the gut, and the potential influence that the bioactive ligand may have on microbiota, gut physiology and, Alzheimer's disease.Results:Retinoic acid can influence neuronal functionality by means of plasticity but also by neurogenesis and modulating proteostasis. Impaired retinoid-signaling, therefore, might contribute to the development of diseases in the brain. Despite its rather direct impact, retinoic acid also influences other organ systems such as gut by regulating the residing immune cells but also factors such as permeability or commensal microbiota. These in turn can also interfere with retinoid-metabolism and via the gutbrain- axis furthermore with Alzheimer's disease pathology within the brain.Conclusion:Potentially, it is yet too early to conclude from the few reports on changed microbiota in Alzheimer's disease to a dysfunctional role in retinoid-signaling. However, there are several routes how microbial commensals might affect and might be affected by vitamin A and its derivatives.",30907321,,10.2174/1567205016666190321163705,12,Current Alzheimer research,101208441,3.04,0.2359876036643982,0.5752508361204013,0.2842809364548495,0.8646427294227191
Mitochondrial Dysfunction as a Causative Factor in Alzheimer's Disease-Spectrum Disorders: Lymphocytes as a Window to the Brain,"Alzheimer's disease (AD) is the most common progressive neurodegenerative disease. Today, AD affects millions of people worldwide and the number of AD cases will further increase with longer life expectancy. The AD brain is marked by severe neurodegeneration, such as the loss of synapses and neurons, atrophy and depletion of neurotransmitter systems, especially in the hippocampus and cerebral cortex. Recent findings highlight the important role of mitochondrial dysfunction and increased oxidative stress in the pathophysiology of late-onset alzheimer's disease (LOAD). These alterations are not only observed in the brain of AD patients but also in the periphery. In this review, we discuss the potential role of elevated apoptosis, increased oxidative stress and mitochondrial dysfunction as peripheral markers for the detection of AD in blood cells e.g. lymphocytes. We evaluate recent findings regarding impaired mitochondrial function comprising mitochondrial respiration, reduced complex activities of the respiratory chain and altered Mitochondrial Membrane Potential (MMP) in lymphocytes as well as in neurons. Finally, we will question whether these mitochondrial parameters might be suitable as an early peripheral marker for the detection of LOAD but also for the transitional stage between normal aging and Dementia, ""Mild Cognitive Impairment"" (MCI).",34879802,,10.2174/1567205018666211208141512,5,Current Alzheimer research,101208441,3.04,0.2359876036643982,0.38461538461538464,0.28762541806020064,0.8265156391217158
Spatial Relationships between Molecular Pathology and Neurodegeneration in the Alzheimer's Disease Continuum,"A deeper understanding of the spatial relationships of β-amyloid (Aβ), tau, and neurodegeneration in Alzheimer's disease (AD) could provide insight into pathogenesis and clinical trial design. We included 81 amyloid-positive patients (age 64.4 ± 9.5) diagnosed with AD dementia or mild cognitive impairment due to AD and available 11C-PiB (PIB), 18F-Flortaucipir (FTP),18F-FDG-PET, and 3T-MRI, and 31 amyloid-positive, cognitively normal participants (age 77.3 ± 6.5, no FDG-PET). W-score voxel-wise deviation maps were created and binarized for each imaging-modality (W > 1.64, P < 0.05) adjusting for age, sex, and total intracranial volume (sMRI-only) using amyloid-negative cognitively normal adults. For symptomatic patients, FDG-PET and atrophy W-maps were combined into neurodegeneration maps (ND). Aβ-pathology showed the greatest proportion of cortical gray matter suprathreshold voxels (spatial extent) for both symptomatic and asymptomatic participants (median 94-55%, respectively), followed by tau (79-11%) and neurodegeneration (41-3%). Amyloid > tau > neurodegeneration was the most frequent hierarchy for both groups (79-77%, respectively), followed by tau > amyloid > neurodegeneration (13-10%) and amyloid > neurodegeneration > tau (6-13%). For symptomatic participants, most abnormal voxels were PIB+/FTP+/ND- (median 35%), and the great majority of ND+ voxels (91%) colocalized with molecular pathology. Amyloid spatially exceeded tau and neurodegeneration, with individual heterogeneities. Molecular pathology and neurodegeneration showed a progressive overlap along AD course, indicating shared vulnerabilities or synergistic toxic mechanisms.",32808011,PMC7727356,10.1093/cercor/bhaa184,18,"Cerebral cortex (New York, N.Y. : 1991)",9110718,4.861,0.2354598045349121,0.6889632107023411,0.5083612040133779,1.2512685248614155
Association of TMEM106B with CorticalAPOEGene Expression in Neurodegenerative Conditions,"The e4 allele of the apolipoprotein E gene is the strongest genetic risk factor for sporadic Alzheimer's disease. Nevertheless, howAPOEis regulated is still elusive. In atrans-eQTL analysis, we found a genome-wide significant association between transmembrane protein 106B (TMEM106B) genetic variants and corticalAPOEmRNA levels in human brains. The goal of this study is to determine whether TMEM106B is mis-regulated in Alzheimer's disease or in other neurodegenerative conditions. Available genomic, transcriptomic and proteomic data from human brains were downloaded from the Mayo Clinic Brain Bank and the Religious Orders Study and Memory and Aging Project. An in-house mouse model of the hippocampal deafferentation/reinnervation was achieved via a stereotaxic lesioning surgery to the entorhinal cortex, and mRNA levels were measured using RNAseq technology. In human temporal cortices, the mean TMEM106B expression was significantly higher in Alzheimer's disease compared to cognitively unimpaired individuals. In the mouse model, hippocampalTmem106breached maximum levels during the early phase of reinnervation. These results suggest an active response to tissue damage that is consistent with compensatory synaptic and terminal remodeling.",38674351,PMC11049136,10.3390/genes15040416,0,Genes,101551097,4.141,0.23528403043746948,0.06688963210702341,0.3612040133779264,0.9827483446838864
Aβ propagation and strains: Implications for the phenotypic diversity in Alzheimer's disease,"The progressive nature of Alzheimer's disease (AD) is thought to occur, at least in part, by the self-replication and spreading of Aβ and Tau aggregates through a prion mechanism. Evidence now exists that structural variants of Aβ prions can propagate their distinct conformations through template-directed folding of naïve Aβ peptides. This notion implicates that the first self-propagating Aβ assembly to emerge in the brain dictates the conformation, anatomical spread and pace of subsequently formed deposits. It is hypothesized that a prion mechanism defines the molecular basis underlying the diverse clinicopathologic phenotypes observed across the spectrum of AD patients. Thus, distinct AD strains might require further sub-classification based on biochemical and structural characterization of aggregated Aβ. Here, we review the evidence for distinct, self-propagating Aβ strains, and discuss potential cellular mechanisms that might contribute to their manifestation. From this perspective, we also explore the implications of Aβ strains for current FDA-approved medical imaging probes and therapies for amyloid. Ultimately, the discovery of new molecular tools to differentiate Aβ strains and dissect the heterogeneity of AD may lead to the development of more informative diagnostics and strain-specific therapeutics.",28359847,,10.1016/j.nbd.2017.03.014,42,Neurobiology of disease,9500169,7.046,0.2349328249692917,0.8729096989966555,0.7491638795986622,1.7247416347809061
[Focused ultrasound as a non-invasive method with therapeutic potential in patients with Alzheimer's disease],"Alzheimer's disease (AD) is a common, progressive neurodegenerative disease characterized by abnormal deposition of β-amyloid (Aβ) and hyperphosphorylated tau protein. Despite the fact that biomarkers and methods of treating AD are currently being actively studied, there is still no therapy that can significantly reduce the progression of this disease. Therefore, the search for therapeutic disease-modifying strategies is becoming increasingly popular. One such strategy is the use of focused ultrasound (FUS) under MRI guidance using a contrast agent (microbubbles). Under the influence of low-intensity FUS, the blood-brain barrier (BBB) is temporarily opened, which is the main obstacle to the effective delivery of therapeutic compounds to the brain, imposing dimensional and biochemical restrictions on the passage of molecules. One of the processes associated with AD is BBB dysfunction, and therefore the study of the effects of FUS in patients with AD is of interest. The literature data show the effectiveness of FUS in animal models of AD. The researchers attribute the effectiveness of the method to the fact that exposure to FUS induces the opening of BBB and reduces the number of amyloid plaques. It has also been demonstrated that FUS can facilitate the delivery of therapeutic drugs to the brain. This allows considering FUS as a new non-invasive method of treatment. Further research is needed to assess the effectiveness of this method in patients with AD.",36279227,,10.17116/jnevro202212210138,0,Zhurnal nevrologii i psikhiatrii imeni S.S. Korsakova,9712194,0.0,0.23458196222782135,0.07023411371237458,0.11371237458193979,0.15479600007916772
Physical activity delays hippocampal neurodegeneration and rescues memory deficits in an Alzheimer disease mouse model,"The evidence for a protective role of physical activity on the risk and progression of Alzheimer's disease (AD) has been growing in the last years. Here we studied the influence of a prolonged physical and cognitive stimulation on neurodegeneration, with special emphasis on hippocampal neuron loss and associated behavioral impairment in the Tg4-42 mouse model of AD. Tg4-42 mice overexpress Aβ4-42 without any mutations, and develop an age-dependent hippocampal neuron loss associated with a severe memory decline. We demonstrate that long-term voluntary exercise diminishes CA1 neuron loss and completely rescues spatial memory deficits in different experimental settings. This was accompanied by changes in the gene expression profile of Tg4-42 mice. Deep sequencing analysis revealed an upregulation of chaperones involved in endoplasmatic reticulum protein processing, which might be intimately linked to the beneficial effects seen upon long-term exercise. We believe that we provide evidence for the first time that enhanced physical activity counteracts neuron loss and behavioral deficits in a transgenic AD mouse model. The present findings underscore the relevance of increased physical activity as a potential strategy in the prevention of dementia.",27138799,PMC5070068,10.1038/tp.2016.65,32,Translational psychiatry,101562664,7.989,0.23440666496753693,0.8127090301003345,0.8528428093645485,1.9009858050005888
O-GlcNAcylation: A regulator of tau pathology and neurodegeneration,"O-GlcNAcylation is the posttranslational modification of intracellular proteins by O-linked β-N-acetylglucosamine (O-GlcNAc). The discovery of O-GlcNAc modification of tau and its impact on tau phosphorylation has attracted recent research interest in O-GlcNAc studies in the Alzheimer's disease (AD) field. Modification of proteins by O-GlcNAc occurs extensively in the brain. The expressions and activities of the enzymes catalyzing O-GlcNAc cycling are several-fold higher in the brain than in the peripheral tissues. The O-GlcNAcylation levels of brain proteins including tau are decreased in AD brain, probably due to decreased brain glucose metabolism. The reduction of brain O-GlcNAcylation appears to mediate the molecular mechanism by which decreased brain glucose metabolism contributes to neurodegeneration. Studies on mouse models of tauopathies suggest a neuroprotective role of pharmacological elevation of brain O-GlcNAc, which could potentially be a promising approach for treating AD and other neurodegenerative diseases.",27126545,,10.1016/j.jalz.2016.02.011,36,Alzheimer's & dementia : the journal of the Alzheimer's Association,101231978,16.655,0.23388130962848663,0.8361204013377926,0.9665551839464883,3.638552866044651
[Genetic mechanism underlying the resilience to Alzheimer's disease and its prospect for clinical application],"As the most common neurodegenerative disease, Alzheimer's disease (AD) is characterized by progressive cognitive decline and is a major threat to the health of elderly worldwide. Aside from its pathogenesis, delineation of the protective mechanism of AD is also critical for the etiological treatment. AD resilience refers to a protective mechanism which can maintain the cognitive intactness of patients despite of genetic risk factors and/or related pathology. Studies on the genetic mechanism of AD resilience are of great importance for revealing novel mechanisms and therapeutic targets, as well as optimizing polygenic risk score which can facilitate early identification and intervention for individuals at risk.",36453972,,10.3760/cma.j.cn511374-20210828-00699,0,Zhonghua yi xue yi chuan xue za zhi = Zhonghua yixue yichuanxue zazhi = Chinese,9425197,0.0,0.23318208754062653,0.07357859531772576,0.11705685618729098,0.15462497158792105
